{
  "$schema": "https://civitasconnect.digital/core/pipeline/v1",
  "id": "urn:core:platform:civitas:pipeline:common:f6cfb736-21f3-86e6-9e2d-0c969c3330d5:1.0.0",
  "title": "Temperatur-Import",
  "debug": false,
  "nodes": [
    {
      "id": "n-start",
      "kind": "start",
      "label": "Start",
      "x-ui-position": {
        "x": 60,
        "y": 220
      }
    },
    {
      "id": "n-source",
      "kind": "source",
      "label": "MQTT Sensor",
      "sourceRef": "urn:core:platform:civitas:datasource:common:bfb49da0-c83b-87ca-ab8e-bf09528e3f38:1.0.0",
      "x-ui-position": {
        "x": 260,
        "y": 220
      }
    },
    {
      "id": "n-mapping",
      "kind": "mapping",
      "label": "Normalisieren",
      "mappingRef": "urn:core:platform:civitas:mapping:common:9b38e37c-0c12-8c9a-8b48-ffeea1269358:1.0.0",
      "x-ui-position": {
        "x": 480,
        "y": 220
      }
    },
    {
      "id": "n-sink",
      "kind": "sink",
      "label": "PostgreSQL",
      "sinkRef": "urn:core:platform:civitas:datasink:common:6354723d-a213-8769-b518-a03c417dc1a8:1.0.0",
      "x-ui-position": {
        "x": 700,
        "y": 220
      }
    },
    {
      "id": "n-end",
      "kind": "end",
      "label": "End",
      "x-ui-position": {
        "x": 900,
        "y": 220
      }
    }
  ],
  "edges": [
    {
      "id": "e1",
      "source": "n-start",
      "target": "n-source",
      "kind": "control"
    },
    {
      "id": "e2",
      "source": "n-source",
      "target": "n-mapping",
      "kind": "data"
    },
    {
      "id": "e3",
      "source": "n-mapping",
      "target": "n-sink",
      "kind": "data"
    },
    {
      "id": "e4",
      "source": "n-sink",
      "target": "n-end",
      "kind": "control"
    }
  ]
}