{
  "$schema": "https://civitasconnect.digital/core-dataset/v1#/$defs/Pipeline",
  "id": "urn:core:platform:civitas:pipeline:luftqualitaet:828cf9fe-8500-86ad-90fd-a7fe0d82ea1b:1.0.0",
  "title": "Luftqualitaets-Import",
  "debug": false,
  "nodes": [
    {
      "id": "n-start",
      "kind": "start",
      "label": "Start",
      "x-ui-position": {
        "x": 60,
        "y": 300
      }
    },
    {
      "id": "n-source",
      "kind": "source",
      "label": "Luftqualitaet MQTT",
      "sourceRef": "urn:core:platform:civitas:datasource:luftqualitaet:a0c94f4e-308e-871b-b8c4-8e7e935d6cb1:1.0.0",
      "x-ui-position": {
        "x": 220,
        "y": 300
      }
    },
    {
      "id": "n-filter",
      "kind": "filter",
      "label": "Qualitaetsfilter",
      "expression": "$.no2.quality != 'bad' && $.pm25.quality != 'bad' && $.co.quality != 'bad'",
      "x-ui-position": {
        "x": 400,
        "y": 300
      }
    },
    {
      "id": "n-enrich",
      "kind": "enrich",
      "label": "Stammdaten anreichern",
      "lookupSourceRef": "urn:core:platform:civitas:datasource:luftqualitaet:04253a60-f4eb-8ed4-993e-005b021d39d0:1.0.0",
      "lookupKey": "$.stationId",
      "x-ui-position": {
        "x": 580,
        "y": 300
      }
    },
    {
      "id": "n-map-no2",
      "kind": "mapping",
      "label": "NO2 normalisieren",
      "mappingRef": "urn:core:platform:civitas:mapping:luftqualitaet:9fd95a60-25ed-8998-8cde-31525e069074:1.0.0",
      "x-ui-position": {
        "x": 780,
        "y": 140
      }
    },
    {
      "id": "n-map-pm25",
      "kind": "mapping",
      "label": "PM2.5 normalisieren",
      "mappingRef": "urn:core:platform:civitas:mapping:luftqualitaet:c48b90e0-4047-8f86-bbf6-4fed6dd06b56:1.0.0",
      "x-ui-position": {
        "x": 780,
        "y": 300
      }
    },
    {
      "id": "n-map-co",
      "kind": "mapping",
      "label": "CO normalisieren",
      "mappingRef": "urn:core:platform:civitas:mapping:luftqualitaet:9d3e2518-756b-8426-a6f0-a7926ae24b3e:1.0.0",
      "x-ui-position": {
        "x": 780,
        "y": 460
      }
    },
    {
      "id": "n-sink-no2",
      "kind": "sink",
      "label": "FROST NO2",
      "sinkRef": "urn:core:platform:civitas:datasink:luftqualitaet:81e33fe1-6c74-853f-9814-c08469ca17f8:1.0.0",
      "x-ui-position": {
        "x": 980,
        "y": 140
      }
    },
    {
      "id": "n-sink-pm25",
      "kind": "sink",
      "label": "FROST PM2.5",
      "sinkRef": "urn:core:platform:civitas:datasink:luftqualitaet:81e33fe1-6c74-853f-9814-c08469ca17f8:1.0.0",
      "x-ui-position": {
        "x": 980,
        "y": 300
      }
    },
    {
      "id": "n-sink-co",
      "kind": "sink",
      "label": "FROST CO",
      "sinkRef": "urn:core:platform:civitas:datasink:luftqualitaet:81e33fe1-6c74-853f-9814-c08469ca17f8:1.0.0",
      "x-ui-position": {
        "x": 980,
        "y": 460
      }
    },
    {
      "id": "n-end",
      "kind": "end",
      "label": "End",
      "x-ui-position": {
        "x": 1160,
        "y": 300
      }
    }
  ],
  "edges": [
    {
      "id": "e-start-src",
      "source": "n-start",
      "target": "n-source",
      "kind": "control"
    },
    {
      "id": "e-src-filter",
      "source": "n-source",
      "target": "n-filter",
      "kind": "data"
    },
    {
      "id": "e-filter-enrich",
      "source": "n-filter",
      "target": "n-enrich",
      "kind": "data"
    },
    {
      "id": "e-enrich-no2",
      "source": "n-enrich",
      "target": "n-map-no2",
      "kind": "data"
    },
    {
      "id": "e-enrich-pm25",
      "source": "n-enrich",
      "target": "n-map-pm25",
      "kind": "data"
    },
    {
      "id": "e-enrich-co",
      "source": "n-enrich",
      "target": "n-map-co",
      "kind": "data"
    },
    {
      "id": "e-no2-sink",
      "source": "n-map-no2",
      "target": "n-sink-no2",
      "kind": "data"
    },
    {
      "id": "e-pm25-sink",
      "source": "n-map-pm25",
      "target": "n-sink-pm25",
      "kind": "data"
    },
    {
      "id": "e-co-sink",
      "source": "n-map-co",
      "target": "n-sink-co",
      "kind": "data"
    },
    {
      "id": "e-sink1-end",
      "source": "n-sink-no2",
      "target": "n-end",
      "kind": "control"
    },
    {
      "id": "e-sink2-end",
      "source": "n-sink-pm25",
      "target": "n-end",
      "kind": "control"
    },
    {
      "id": "e-sink3-end",
      "source": "n-sink-co",
      "target": "n-end",
      "kind": "control"
    }
  ]
}
